id,username,bookid,review,rating,timestamp
1,franz,25742454,"Not my cup of tea...",2,2021-01-01
2,franz,30128855,"Very good! Best book I've read.",5,2021-02-07
3,nerd75,27036537,"Almost perfect.",4,2021-04-25
4,nerd75,11827783,"It was alright. Kinda meh.",3,2022-04-25
5,nerd75,25742454,"Pretty good.",3,2022-08-15
6,franz,707611,"Lorem ipsum dolor sit amet, consectetur adipiscing elit, sed do eiusmod tempor incididunt ut labore et dolore magna aliqua. Ut enim ad minim veniam, quis nostrud exercitation ullamco laboris nisi ut aliquip ex ea commodo consequat. Duis aute irure dolor.",3,2023-06-20 13:14:43.920668